category,text
Negative , Onte oru ikkayum kunjikayum muttamurianss of the country
unknown_state , Padam flop aakumenn  thoonunnavarkk like adikkanulla sthalam..
not-malayalam , I like u sir u my Ysr
unknown_state , Super movie.. undayum illa oru andiyum illa
Positive , Ejjathi ..  Item.... Lalettanum fansum pwolikmmmmm
Negative , Degrade cheyyunna narikale ningalku asuya Undo ulladukondavum dislike Pedichoo kurippeleee
not-malayalam , TamilNadu Megastar Fans Like Pannu
unknown_state , Tgf
unknown_state , Raja odiyante first day record thagarkum ennullavar like
unknown_state , Hindukalaka ivan mahi ravanan islamil ivana ibilis yena parayum christanikalka idayil ivana oru pera oluu LUCIFER
Positive , Super movie ella arum kananam   Suraj robo  combinations kalakki  Vathyasthamaya oru anubhavam
Positive , 103k likes within 36 minutes Ufff pwoli lalettaaa...  Waiting #Mamookka_fan
unknown_state , VAADA scene 1:51 veendum kaanaan vendi maathram vannavar oru like  adiche
unknown_state , Padam kantavera onu like addiiiee aaa
Mixed_feelings , Puli murukan . Ithokke enth
unknown_state , Hindukalk Ivan mahiravanan Islaminu Ivan ibilis ennu parayum Christianikalkidayil ivanu oru pere ullu LUCIFER... Goosebumps....
unknown_state , kk anu   stunt #ptr ishtam ikka   stry
not-malayalam , Maranamass waiting April 12 Madhura raja day
Positive , #Lucifer Cinema Kandittu Vannavar Arokkeyundu...Nice Movie  Claimax Vere Level
unknown_state , Lucifer rajaudea appan ayyi varum ennu thoonunavar like adeee
Negative , Dislike adikkan vanna aattan paansinu naduviral നമസ്കാരം
Mixed_feelings , Buildup mathrum avaruthu ... Padam super aya mathiyayirunnu..bros
Positive , Oru reksheyum illa kandittu oru tamil padam feelings
Negative , Njaan mammoka faan aayi... laletta aaa pazhashirajayum chathiyan chanduvum oke onnu poyi kaanu...
Negative , Dislike count kootan budhimuttuna chila aalukal
unknown_state , Trailer kandavar thanne veendum kure kande treding il nilanirthan sremikunnu..ennal views keyarunnum ella..etheppo madhuraraja kke kittiya views polum ella
unknown_state , Last oru palli kaanikkunnille athu eetha place
not-malayalam , Waiting     8
Positive , Rahumanaaa ne polikkadaaa... My dear class mate🥰
not-malayalam , Any Malayalam people like hit
not-malayalam , Superb movie
Positive , Kalakki ithu box ofice aaghosham aayirikkum
Positive , 0:15 sec..... Ho... Romanchification... Ikka pattu padi thimirkkum...
unknown_state , Just 30 minutes 150 k viewers raja ezayalattupollumilla
Positive , ee video onnu kandu support chaiuka
Positive , Ente ponno ah sound🥰🥰 poli poli🤘
unknown_state , Ambo ethele mamootede lookene vadakan veeraghadha poleyille
not-malayalam , Thirunathe vullym ninda jappan sema payangarama yosikiringa
Positive , Chilapo Tovino nu Superstar Pathavi Nedi kodukaan pokunna chithram
Positive , Padam motham twistukal aayirikkumennathil samshayamilla
Positive , Lalettaaa pwolich..... Ntammow Katta waiting..... Lalettaaaaaaaaa
Positive , Padam kidu mooneee kaanan marakkalle ethupole padam kandillegill you is bad man
Positive , Directed by Prithviraj Sukumaran  idhu pwolikkum
unknown_state , release date maatiyowaiting  ikka ishtam
Positive , Lucifer um madhura rajayum  block buster film avatte........
Positive , What a trailer. Amazing  ഇത് കലക്കും.
unknown_state , inni kure peru varum njn lalettan fan annu.....athanu ethanu sho🤣🤣🤣🤣
unknown_state , Mahaa avathaaram piravi edukkan ini 19 naal
unknown_state , Ee teaserinu Amal Paul linte filmum aayi saamiyam thonnunavar like adikku
Positive , Njan ഇക്ക fan aanu
Positive , Oru thavanayil kooduthal like adikkan pattuo
Negative , Ithu award padam aano full slow aanallo
Mixed_feelings , Bgm oru rakshaym ilaa. Eppolm mammokaye kateelalo
unknown_state , Ethena makkalee item ane paranal raja
Positive , Ente ammoo.... Aaa super man punch undallo ...Ijjathi item.....
not-malayalam , My lalatta aaaaaaàa IAM waiting
unknown_state , Lucifer trailer 2020 kanunnavar undo like here
Negative , Sheenam trailer.ee keleavan ed nirthaana aayille
Positive , Pwolikum muthee Unda EID MUBARAK تقبل الله منا ومنكم صالح الاعمال عيد مبــــــــــــــــــــارك   IKKA FANS LIKE ADICH POTTIKK
Negative , DISLIKE ADICHAVARK  IRIKKATTEE  ORU  KUTHIRA PAVAN......*ejjathi ooolatharam
Positive , Kazhinha 8 kollam mai ee peru kelkunnu.. but 5 kollamai kathirippum....athu vere levelil
Negative , Thrissur baasha athra pora ennu trailer Kanda ppl enikku thonni ningalko?
Positive , Mass kolla mass etra vattam kandu enne areyella .
Mixed_feelings , Kollaam pakshe lucifernte athrak ethilla urappaanu
unknown_state , Mammukka yude unda kaaanan wait cheyunnavar like adikku
Positive , Moonu divasam no 1 trending on youtube
Positive , Unni mukundante courier maatan povunna movie aarikum mamankam
not-malayalam , Is movie se illuminati cast ko badaba dena h
unknown_state , Padam kanditte ite kanan vannavar like poduu.
Positive , Anu sithara & kaniha menon നായികമാർ........ Lovable...... and mammookka is always KING
Positive , Ithu trailer pole illa oru teaser.. Enthayalum sambhavam kidukki... Waiting...
Mixed_feelings , Surajettante character kurachu prayam Ulla aal ayathu kondu dubbing il on nude sredhikamayirunnu.. Other ways kiduu....
Negative , Mohanlal n ee veruppikal  nirtikuude... Enth kaaanichalum   stuthi  paadan kure koonathile  pans.....
unknown_state , entammachiii... njaan Mammoottykkaane kaanaan vendi maathramaanu ee trailer kandathu...
Negative , Ithinte munpil raja veezum. Release date maattikko raja
unknown_state , likes innale 175+k undayirunnilla in engane kuranjhu
unknown_state , Tovino yil oru villain mannakunathu enk mathramano?
unknown_state , Ellarum sradhicho ennariyilla pakshe enikk ee trailer adichappol 10 same trailers vannu ithokke aarude paniyaa
unknown_state , Mamooka grls fans evde hit like
Positive , Mammoka polichu.  .. Onnum parayaanilla.. The king of Indian cinema Mammoka
Positive , Romagam mammooka nigale ennum young anna..
unknown_state , Sunny chechiyee kannan vannavar like adi...
unknown_state , Lucifer trailor 8.5 m pakuthi enkilum aavuo
Positive , Tovino mass alle eeee filmum adpoli aaakum  Oru rakshayum illa tovino mass aaam
not-malayalam , ಕನ್ನಡದಲ್ಲಿ ದಯವಿಟ್ಟು Dub ಮಾಡಿ.. ಮೋಹನ್ ಲಾಲ್ ಅಭಿಮಾನಿ from Karnataka... Mohan lal fan..  Best wishes to Lucifer team..
Negative , Mass pora..lag anu alo... trailer um padavum...be careful
Positive , Thakarthu Jayettaa..  katta waiting for Pullu Giri n Team
unknown_state , Mamangam Release date mattiyo ???  Wikipedia  il December 12 ??????
Negative , Guest role aanu ..athinu eni valiya thallu venda....
Positive , Onnum parayan illa polich adakki mammookka
Positive , youva thara nirayil eni yeattavum muzhangi keelkkunnath tovinoyude Peru aayirikkum...
Positive , Film kandu.....Nalla movie aan dharyam ayi book cheythoolu🤗
Negative , Gopisunder pulimurukan eduthappozulla music padangal onnum marnnittia...engu rajayil eathinilkumbazum..elllam oruikalkudui avatharippikunnondu
Positive , Trailer pwoli ............... .25
Mixed_feelings , Trailer...kozhapila.....cinemayum nallatai vernam....pritvirajine viswasam Anu....but murali gopy story ayond Oru pedi
Positive , Video kanunnathu munne comments aanunokye  ath kndple video sPrb aavummnnuthonni  powli  kAtta waiting fOr LUCIFER
not-malayalam , This movie deserve double Oscar
unknown_state , Surajettane kndappol ravanaprabhuvile varyar ammavane ormma vannavarundo
Positive , Katta waiting lalettaaaaa2' nd on trending kuwait
not-malayalam , Who else after mamankam trailer 🥰
Positive , Oru rekshayum illa......katta waiting......mathukutty mike kondu maathram alla camera kondum njettichu kalanjirikkunnu
unknown_state , Black t-shartil iruttinte maravil oro  scenilum  kanunath rajuyettanu
Negative , Thallu vidunna moopanu pakaram appan  Daddy girija  Peter hein fight ( parannadi) Pulikk pakaram patti  Pinne mainayum same costume (Anushree)  .
Positive , Kgf movie kanda pola oru feel..... Endhayalum laleta kalakki
Positive , Cinemakal koodumthorum age kuranju varuvanalloo.. Kidu look..  HBD IKKA
Positive , Mamangam marana mass akum allathe pinne
Positive , Ithu njangal polichadukkum. Love you latetta.....
Positive , Raja trailer nu oru pulimurugan touch.. #goosebumps
Negative , Raju ettan kurve  nallonm thonnunde
Negative , Oru njettalum illa romanjavum illa ayye
unknown_state , Gunddaa rashtriyum.... Swandammmm raksthasakshikkaleaa enddakorkkk kaananddaa padam
unknown_state , Ittychante Vakka Oru Simple Vedikatte  Ufff  Adi Makkale Like
Positive , Padam kand trailer kanuvan vannvar undo..poli film
Negative , Nairmare vendannu paranja Kallamark kanich koduk ...Nairmarude karuth...lalettan and prithivi...tholpikkanam ee electinu....
unknown_state , Lalaten fan onnu ange like poratta
unknown_state , Voiceatokke ikka kasargod muthal tirupanantapuram vare
not-malayalam , Dei hard ikka Fan's like here
unknown_state , Saathana vellan kelpulla rajavu ennu thonnunnavar like adi.
Positive , Mammookka  love you ikkayanu loka ithihasa nayakan kolakomban...
Negative , Dislike adikkunnna 12 k kundanmare poyi ooombikkolu adhey nadkkuuu nanamkettttav hijadagal
Positive , lalettan screen presence 100 percent in trailer. Lalettan politics and actionil thakarkkum ennullavar like adi........
Positive , Last oottam kanddo makkale onnum parayaan illa aaa face lle mattam anergy uff powlikkum ikkaaa
Mixed_feelings , Pala bgm um ketta pole thonnunundelum kidu feel
Positive , Polichu  Pakka Oru Telugu Thriller Movie Pole Und.. Enthayalum Lucifer Theater Polichadukkam...
Positive , Vysakh etta padam kandu  oru raksheyum illaa  powliii Ningal marnamassalla athukkum mele aan Waiting for #Minister Raja
Positive , Annnnnnooii oru rakshem ella pwoliiiiiino words
Positive , Kidu energetic trailer     dislike adikkanum venam oru manakkatti
Negative , Lucifer kanduu..... Thatikootuu padam....no story aake ulath kore vedivepum bombidilum..... Kashtmm thane.....
Negative , aaa dislike adicha poorimakkalude ammakku mohanlal anu adichu kodukkunnadu tonnunnu
unknown_state , Njan kandu  Mammooka ithan.. Da dhamu ni tirnnada
unknown_state , Tovinokk Rahul Gandhide oru chaaya kaachal 🤔🤔🤔🤔
Positive , Padam kndit vndum trailer kanumpo veror feel
not-malayalam , Iam from andra  I like malayalam movies
Positive , laletta na pole orale ullu malayalikalude ahagaramaya mohnlal
unknown_state , Mamooka Dulquerinde Bappa anno adho chettano🥰
not-malayalam , Marana mass waiting for #Madhura raja
Mixed_feelings , Ithu pradheekshikuna ....pole avilla ...padam avarage ...
Positive , Youtube enagne  hang akathirikkum .korach koodiya item alle vannikkn
Mixed_feelings , Pulimurugan copy adi pole ind stund seen ellam
Positive , Ee vishuvinu Madhura Rajayude oru Madhura കണി....  By a Lalettan Fan
Positive , 38000000 viewrs oh my goddddddddddddddddd  megastar the gr8
not-malayalam , Sir hindi movie nhi he kya 🤔🤔🤔
Negative , Trailer pora..Oru pathu kollam mumbulla tamil cinemade trailer polund
Positive , Oru 10 thavana kandu
Positive , Mammukka oru rakshayumilla. Mammukka mass ....
Positive , trailet ingana.appo cinema enganayundanne parayano... katta waiting..KL 40 fans
Mixed_feelings , Orumathiri tamil mass padam pole thonnunu...daivam noke parangu politiciansne oke ingane thalapathuvekkunne aavishamillatha hype alle ???.
Positive , Entee ponn ettaaa..... 1:50 ullayaa ah dialogue oru rekshayum illaaa.....  VAAA DA.....
Negative , Ipo allarkkum manasilayille lalunni charitra padam cheytal ingane undakum enn this is odiyan 2
unknown_state , Oru 10 pravishyM kandu ttaa rashidheee Chayim kadim marakkanda
not-malayalam , Hope all unlike hits from ikka fans
unknown_state , Rajuattan fans & mammokka fans like
unknown_state , Trailer kandu ethil oral ella? Aru
Positive , Padam kandu .....sidheeq ikka ....karayipikum alle ..ithoru sheelavakanda
Positive , Ikkaaaaa masss enn vechaal ithaam masss
unknown_state , who delet madura raja trailer in youtube. yesterday kittiyirinu ippo link ullavark mathraman kanan saadikunath. wat happend
Positive , mohanlal anna ningal veru mass alla kola massaa
unknown_state , [ L ]      ABRAHAM QURESHI
unknown_state , 6 mani aayillenkil polum ippozhe wait cheyyunna katta ettan fans like adichittu poo
Positive , Mohanlal. THE GREATEST OF ALL GREATES.
Negative , Pooran mamooty
not-malayalam , Superb Movie. Love u Mohan Lap
unknown_state , Ee flim ne support cheyyunnavar kk urapundo nigalk ithi 3 IL athikam time kandit super anenn parayan pattumo?
Mixed_feelings , entho missing aanu
not-malayalam , Make a way for 200k likes
Positive , Ellarum ikka ikkaa...Njan mathram anooo unni chettane mention cheyunnadh...Unni chettante pwoli
Mixed_feelings , Lucifernne EzHuayallathu varakilla nnu urapaa pakshe padam pulimuragan level hittaa athu suraa
not-malayalam , madhuraraja 3 hour 111k views lalettan in minutes HAHAHA
Positive , Raju etta ningal Malayala cinema ye Vere Level Aaakum Alle
Positive , Variety cinemayude rajav  mammooseeee ikkaaaaaaa
Positive , Eee vishu ettan aganu konduvaa ennu parayan paranju!!!!!!
not-malayalam , Great film from mega star Mammookka
Positive , Entta ponnu laletta.... Parayan vakkukal illa  Mass ka bapp
Positive , Ithippo enthinulla purappadanavo randalum koodi Suraj  Soubi
Positive , Waiting from Qatar LalettaI'd tagarkum katta support heavy 48pravasyam trailer kandu wow
Positive , Ee item vech nammal nammade pracharanam thakarkkum..
unknown_state , Ith nammal vijaricha unda alla makkaley ith vedi undayanu
Positive , enthe ponno enna lookkada mmmde eattan
Positive , Ithu kidukkum Vere Levelu Aannu Makkaleee
Positive , Heavy mass        പൊളി
unknown_state , 15 minutes.... 151 k viewrs...
Negative , Adutha flop
Positive , Vere level ... Onnum parayan ella....
Positive , Mamooka ishtam. Ennitum Njan Lucifer kandu laletante acting Kidu anennu mammokka fan aya enik parayAthirikan pattilla..
Mixed_feelings , Oru nalla cinema kkaayi kathirikkkunnu.    Dhayavayi ithine 100 cr pattikayil kettaruth
Positive , Mass and class . Mammookka #faceofindiancinema . Nalla cinema aavatte
unknown_state , Daily 3 vattam kaanunavr undo evide?
Positive , Rajuettan director ayath kond ith jaikkuvairikkum
Positive , Njan oru mohanlal fan aanu ennalum trailer istapettu pwoli
Positive , Ikka scene vere level
Negative , Ithupole mooonchiya Oru padam jeevithathil kanditillaaa.....
unknown_state , Ithill Tovii polikumnn ullavar ivde like adii
Negative , Trailer kannunathinu munne dislike adicha mahanmark adaranjalikal....ivrk matram engana pattunoo ijathi kuru pottikal....kashtam...
unknown_state , NIMISHANGAL KONDU 34 K...BUT IPPO KURACHU NERAMAAI ANANGUNNILLA
Positive , Uff kidilam oru ethum pediyum kittanilla story nthayirikkumenn 5vare Kath irikkanamallo katta waiting
Positive , Etinum valiya surprise enni njngallu kittan ella
Positive , LUCIFER KI JAY  LALLETTAN POLICHU MASS  VERUM  MASSALA  MARANA MASS LOVE  YOU LALLETTAAAAA
Positive , Joy thakkolkaaranil ninnum oru massZz change
Positive , Njangada nattila shooting cheythe Prithviraj vere level
not-malayalam , Happy B Day MY Dear Mammookka
unknown_state , blast fdfs  Palakkad ntea own odiyan
unknown_state , 5 million! Like adi makkale!
Positive , Padam 100 cr kayariyathinu shesham kanunnavarundo
not-malayalam , Die Hard Mammookka Fans Like Here
Negative , Myru Padam. Kaanendaayirunnu. Ookkaanam vannittu vayya.
unknown_state , Lalettan & Ikka Ki Jaiii....... Frdzzz... Fishing Videos or Tech. Thalparyam ullavar nammude chanel sandharshikuka...
Mixed_feelings , Ikka kku nalla age feel cheyuunuu
Positive , anusithaaraye kaanan veendi trailer kandavar ivide like cheythooli
Positive , Kiduuu Trailer   Lalettan polichuu Apol ee onavum ettan kondupoi
Positive , Njan A10 Fan ann but ikka pwolikkum katta waiting
Positive , Mammookkaaaa love uuuuu ingal poliyanuuuuuu 68 alla ingakk  34 aanuuuuuu
Negative , copy annan
unknown_state , Like adich cmnt vaayikkunnavar like adi
Negative , Pandi rajaye malarthi adichu athanu lal magic
Positive , Poli poli poli .... am waiting..
not-malayalam , Subscribe to my channel to get you all new
Positive , Lalelattanum raju ettanaumulla oru film kure kalamayi aagrahichirunnu  athu nadannathilulla santhosham pinne parrayanundo🤩🤩🤩🤩🤩
Positive , Poliiiii oru rekshem illa katta waiting
Negative , Dislike adicha oombanmaarude shraddhakku....  Kittiya collectionum kondu oodikko  Chekuthan ninte ettane eduthittu oookkunnund  Adyam avante kunna vayileduthu ethane rakshikk
Negative , 369 dislike myrol ikka uyir haters myr
unknown_state , 4m views 300k likes trending 1 Mollywood king  ലാലേട്ടൻ
unknown_state , Ittimani mannikunnel ittimani uyir mannichayan loading just 8 minutes
Positive , Telugu film pole masss  trailer
Positive , Hindu kalku mahiravan islaminu ebileesu christianikalkku LUCIFER
Positive , Mohanlal fansinte full spprt ikka pwlichadukk .
unknown_state , Padam kandit ittymaniyude trialer kannan vanavar uddoooo lalettan fans like theme adipoli
Positive , Maranamass item ente ponno  ijjathi
unknown_state , Lalletan fans like adikku . Fans power kaaniku
Positive , Happy birthday  ikka movie polkikum....
Positive , entay ponnoo kola kolli item vannu makkaleay
Positive , mass aaan ikka ninga vere level aan
Positive , laletta movie kku super response aanalloo
Positive , Mass itom. Mass dialogue. Lalettan polikum
Positive , Arokke endokke paranjalum ingal Mmale changan Dileepetta
unknown_state , Ee item vech nammal nammade pracharanam thakarkkum...aa item sunny alle
not-malayalam , South India next level  Malayalam- Lucifer Telugu - bahubali Kannada - Kgf Tamil - 2.o
Negative , Ee dislike adichavarde sredhayk enna kanditta enth mosam kanditta dislike adichathenn koode parayamo?
Positive , Pakaram vaikkan..ellatha prathibha....lal.... njan paranjathu sheriyalle...plse like
not-malayalam , Best of luck from rocking star yash fans karnataka
unknown_state , Athoru kadaya mone paranj thudangiyaal 10-30 varshathe kada parayendi varum
Positive , mohanlal ingnanu kure chavar pole irakkilla .vanalo...odukkathe varavaakum..luv u laletta
unknown_state , ithu kandu pazhaya school kaalam oorma vannavar ivide like adi only for govt scholl piller
unknown_state , avan Varum ente Makan Madhura Raja....
Negative , Deslike adicha ella punnara makkalkum nanni
unknown_state , Friendship day k oru cake vangi koduk...🤣🤣
Negative , Poli padam njn ella mammooty movies kanarundu itrekku disapointed akkiya oru movie aduthundayittilla
Mixed_feelings , Freezerinakathulla scene kandappo arkenkilum hollow man film orma varunnundo
Negative , Aah nalla best marakkar...sound kettal thanne ariyam...ithu adutha neeraliyo odiyano aavanulla laksham aanu...daivame ee pulli ithu enthinulla purapadu aanu...🤣
Positive , Muppathil kooduthal thavana kanda njanalle sherikkum mess
Mixed_feelings , avasanam kanjipole aavathirunal mathi all the best
Positive , Oru tamil movie touch pole. Expect to be a good movie
Mixed_feelings , Pulimurugan pole akkan ulla udesham bt release kazhinj parayam kollavo elliyo enn
Positive , Polichu
Positive , Padam kanditt veendum trailer kaanan vannavar aarengilum undo enne pole
Mixed_feelings , Ith kalki allaa ith kathi aahnu itiri
Mixed_feelings , Swantham panavum padavum aauapol experimentation undavumo;)
Negative , Padam ettunila pottum ennu urappullavar like..
Negative , Ayyeeee....dialouge presentation ottum illa....evan enge nayakan ayi? Lalunni....evanano swayam complete actor ennu vilikanee.....myran
Positive , mammookkaye ee traileril kandu njettattavar aarum undavilla !
Positive , Oru thrilling und...  Padathilum ith muzhuneelam undakumennu karuthunnavar...  Like here
not-malayalam , Telugu people from telangana like here
unknown_state , 4  m views.... 300 k likes...
unknown_state , Ee cinemayke katta wait cheyyunnavarke like adikkam
Negative , Aayea.... ithu oru unda aavolo.... boar ....
Negative , enth moonjiya padam oombiya kadha parachil avante konathile padam
unknown_state , mammutty guest role aanenn thonunnu piller pwolichu 🤘🤘
unknown_state , 300 cr adikkum annullavar like adi
Positive , Haneef adeni  Ninakevdunna mone ijjathi kolakolly items kitenne Vere level
unknown_state , Ithra pettenn 12 k likes
unknown_state , Padam pottumn orapulavar ivide like adik
Positive , No words to say katta pwoli van mass
Positive , Petrol vila karanam raja cycilil. polichu!!!!!
unknown_state , Mamankathinte naatukar tirur tirunnavayakkar adi like
unknown_state , Ikkenem akkenem kanan vannavar like adi...
Positive , Pala chettakalum chelakkatte ith onnonnara padaman
Positive , Licifer vannna ennenthe pooram vanu.....madhuraraja 6 manik thanne poyi......but l is loading...coming....minutes left
Negative , theateril elaarkum moonjiya expression aannallo kandu kazhinju
not-malayalam , Ada paavigala idho edho youtube advertisement nu illada naan swipe pannitu poiten
Positive , E oru trailarinu vendiyanu njan kathirunnathu powliyanu... Kiduvanu... katta massanu....
unknown_state , Theatre il ninnu nenjum virich irangan aavo entho - oru odiyan orma
Positive , Malayala cinema yude thalavara maattum e padam
not-malayalam , 0:40 indian Flag Ulta q hai?
Negative , eth 14k alavalathikal aanu dislike adichath
Positive , Kidu trailer oru rakshem illa katta waiting
Positive , KGF kanda oru effect trailer kandapol kitty
unknown_state , Subtitle undenkil views kooduthal kittumaayirunnu. Like if u agree
Positive , Katta waiting aliyoo njanga malayalikalkkum nddaa mass padangal
Positive , Surajettan ippol kadhapathramayi jeevikkukayanu.. mikka cinemakalilum
Positive , Polichittund Lal ettan fans like adi
Positive , pwolikkum #Unni #mammukka oru valya vijayam aakatte
unknown_state , Padam kand kazhinjathin shesham vannavar like adikk
unknown_state , Pothirachi oru 4 kilo aanu 2 alla
not-malayalam , 1Lakh 50k+ views and 95k+ Likes What matters....? Lalettan Matters
Positive , Kolakolli Item Ikka war mode on
Positive , ട്രൈലെർ കിടു  Wishes to Janapriya Nayakan Dileepettan from Lalettan Fans
Positive , onnil kooduthal thavana trailer kandavar pls like here
Positive , uff trailer  mamuka mohanlal legends aanu oru tharkavum venda
unknown_state , 1:23 PREDATOR movie BGM copycat !!! deepak dev anna
Positive , HAPPY BIRTHDAY IKKKAAAAAAA  LOVE YOU IKKKAAAAAAAAA
unknown_state , 65 k ലൈക്‌ 16 k view hangayi
unknown_state , Ithilum bhayankara suspense aayi Mammukka police aayirikuo
Positive , massakkan  3.14 m venda 1.46 mathi love you raja
Negative , Jai marikkunnath kandappol othiri sangadamaayi
Positive , Njan Ettan fana ennaalum paraya e padam polikkum
unknown_state , All kerala lalettan fans  Like adikkkee Nammude power kanilkkee
Positive , Lalettanu Thulayam malayalam film industry yil Latten mathram...
unknown_state , share and support please ..njammude jayyetan vendih...chadiyan chanuduni vendi...ah adh poote Shaji pappou....vendih please
unknown_state , Kunjikkaaa fansss adi mone likeeee !!!! Ikkaaa fanss pottiiiikkk likeeee !!!!
unknown_state , Aa posteril kanda hand GOTil ullatalle
Positive , cinema kandu....addipoli.. adyamaayitta oru cinema adhe divasam 2 thavana theatril kaanunne
Positive , Adipoli Trailer.......   parayaan Vaaakkilaa  Lalettan fans like here
unknown_state , Candle shot pollikkum ennullavar like adiche
Positive , kure naalu koodiya oru mammookka trailer kaandu santhosham thonunnathu.
Negative , Kutam parayunavaru Maryadaku zha parayan ariyatha team anu
Positive , Jayettan + Thrissur Oru Ugran PooraM Kodiyeri makkale...  katta waitin
Positive , Ho aaa BGM. Mammookka ithu oru pwoli pwolikkum
Positive , Ithu oru onnonnara item anu makane ee........Mass alla athukkum meleee.....
Positive , Sirea ethu keari koluthunna lekshanam undallo... bumbar hitavattea
unknown_state , Kurbana kudi randu kilo pothum vangi ponalo....athanallo achayan
unknown_state , Fan show tikket kayyil kittiyavar like it
Positive , Venda kutta uruttam last dialogue polii....
unknown_state , Oru kannu adachu pidichittu aduth vechonnu kandunokkike
unknown_state , Malayalam comedy thug life.ithu kaanu chirichu marikkum...
Negative , Pavam sanjeev pillaiku enthengilum credit kodukeda nayinte makkale
unknown_state , 1M view munne ee trailer kandvar aarokke
Positive , Ente mammookka  Ithokke abhinayikkanel minimum range venameda  Vere level
unknown_state , Idhilum Manju warrierude husbandine konna aale kandupidich kollunnathaano kadha
Positive , TRAILER VERE LEVEL ... ITH PWLIKKM
unknown_state , 17k views 67k likes  pakka autolike
Mixed_feelings , After Neram
not-malayalam , Katta waiting Maamangam & mammooka performance also
Positive , Nice ... Varampo kaanam engana nu ....
unknown_state , Trailer kandapo oru karyam urapichu #LAD
not-malayalam , Happy birth day. Dear megastar mamookkaa
not-malayalam , Super trailer love from Karnataka I
unknown_state , Dey nthonadey refresh adikumbolathekum likes okke rand erati avunnu
Mixed_feelings , Pazhanjan formula aanaloo .....  Oru gramam
unknown_state , stock roomil stuck aaayi freezing room
Negative , cia   bgm  tch   undalllo  copy  etttaa
Negative , Ethreyum nalla oru creativity ku dislike cheyunnavarodu oru load pucham
Positive , waiting  ganagandharvan mamankom sherlock bilal  enik vayya.... mass ka baapp
not-malayalam , android kunjapan review on movie slot media
unknown_state , 4 bangalikal mannu valichu kadalilekk ittal theeravunnathe ullu ninte Japan
unknown_state , Valla 200 cr anaganam nirthiya mathiyarnnu
Positive , Mammootty enna name thanne mathi charithra cinimakal poyi kaanan
not-malayalam , Great luv frm a Lil girl...allah blss u...🤲
Positive , 30 minute 34 k views padam poorikum
unknown_state , Anu  fans like Ikka fans comment
Mixed_feelings , mohanlal fananu but e filim ethraku pokanonnum ella. raju ethilentha amanushikano?
