category,text
Mixed_feelings , Ben johnson mani police was soopr.  Idikkokke enna weightaa. Tovino pora
Positive , Ente ponno ithreyum kathu irunne trailer vere illa ikka uyir
Positive , Jayasurya pandathetilum poliyali enn tonniyatu enikk maatramanno
Negative , Dislike adichavan maarude nenjathu irikkatte ente like THENDIKAL
unknown_state , Koreye naalayi adi padam kandit..
unknown_state , 4 million ayonn nokan vamnnavar like... cmnt
Positive , Lvl trailer Raju etta polich Odiyan ondakkiya chethapperu marum enn urappayi Good work
unknown_state , Eth 2 um kalpichulla padam aanenn urapp aayi
Positive , First show kanum enn urappullavar like adi
Positive , 28 lucifer release ente bday pwoli
not-malayalam , Kali bwendaa mwonee ikkka mess daa
Positive , Film kandu..mikacha chithram..mohanlal manju warier magic..
unknown_state , Vindum vindum repeatadichu kanunna lalettan fans undel ivide likeadi
not-malayalam , Iam tamilnadu kerala peoples also good
Positive , rajuvettan marana mass .....laletan kola mass
Positive , NEXT MASS HIT OF LALETTAN...MARANA MASS HIT
unknown_state , Ethu kochunni model aanooo...ankil lalettan polikum....
Positive , Ikka uyir aane ennullvar like adikk machaanmaree 🥰🥰
Positive , Bahubaliyumayi kattakk nikkan pattiya padam. Mammmookka U are still young
not-malayalam , J'adore ce film et cet acteur
Positive , Kayy adi makkale parayam verum akkagalakki mattiya manushan
not-malayalam , i am Kannada i dont understand language but super
Negative , irangunne munne dislike adikkunna thanthakku munne undaaya makkalku midile Finger
Negative , oola mammootty ku pattilla ithu cheyyan
unknown_state , Trailer kanda trolanmarukku ettinte pani kodutha etttan te mass entry kku kodukanam oru like
not-malayalam , 1.56 to 2.00 made my day
unknown_state , trailer verunnathinu munpu dislike cheythavarkkum ikka hatersintem nenju thulakkunna unda  ayirikkum eee film ennu urapp ollavar adi like
Negative , Muttamariyans Mammunni Myra raja team omkv
Positive , Katta lallettan fana..ennalum trailer Kollam variety ayitund.nice bgm....
Negative , Oooo Odiyan
Positive , Oru vattam kandittum veendum kanan vannavar like adikke...
Positive , Ente ponneda uvv ee
Mixed_feelings , Japan ne patty angane paranjath ottum sheri ayilla...ee dialogue ezhuthyavan odikkunna vandi Japan il undakkiyathanenn orkkanam
Positive , ഏട്ടാ......  മാസ്സ്....  ...  വയ്യ....  പൊളി ആണ്......  no.  Words...... luv ഒരു ആയിരം ummmmaaaaaaaaaaaaaaaaaaaaaaaaaaaaaaaaaaaaaaa
unknown_state , Alla pokri rajyil sidekinety Kai vettuley
Positive , Ithann njangal kaathirunna vintage ettan  love you etta
unknown_state , Rajaye... Kandittu derickine kanan vanathu njan mathram anooo.... 🤗
unknown_state , Raja chaadiyal muttolam pinnem chaadiyal chattiyolam....
Mixed_feelings , Chela forest seen okke evido kandapole 🤔🤔🤔🤔🤔 aaaaaaaaa.......pulimurukan..........
Positive , Mass movie. Madurai rajja odikko
Positive , Adaar item orungi....kaathirunnolu ini ball njngalde kayil aan....!!!
unknown_state , Lalettan fans like adike support me
Positive , oru rakshayum illa surajettande abhinayam surajettande abhinayam ishtapettavar thazhe like adikvo?
Positive , De pinneyum youtubil trending no 1
unknown_state , Kumbalangi nights ile penkutti allee ith
Positive , Randennam adichitt kaanumbo waav........ Sooooooooperb trailer.... Lucifer le L neengumbo....   Ennaaa oru paranjariyikkaan pattaathathra aimaaaaaaaa....
not-malayalam , Thalapathy vijay & lalettan fanz hit like
Negative , Nalla oombiya trailer.. Mammootty kilavane kayaril ketti pokkunnathu kanan ente patti pokum...
unknown_state , 0:42 big b aane enne thonne pooye
not-malayalam , face Of Indian cinema Mega  Mammokka
unknown_state , Who are you mr  Athoru velya kadhaya mone  Paranj tudangya oru 10 - 30 kollathe charitram prynm    Ikkaa
unknown_state , Ee kidu remake onnu kandu nokku
not-malayalam , mohanlal all over tamil nadu fans club again... love u thalaiva vera level...marana maas.
Positive , Trailer pwolliiii Eni padam koodi set ayaaa
Positive , Oh . Oru rakshem illa . Emmadiri item .
unknown_state , aa ting ting piano evidayoo keettapolle...🤔🤔
unknown_state , 5th മെഗാ hitte eannu urappullavar അടി makkalle likebutton
Mixed_feelings , kandidte oru shogam padam akuna thonathe parayan patula mamooty prithviraj okke inde
not-malayalam , Tovi 🥰 Best Wishes From #Kunjikka Fans
Negative , Thalkalam dq um rajum nivinum okay padanjarottu thirinjirinno
unknown_state , 1 year of AS.  Aarokke trailer kanan vannu 1 year aayath kond
Positive , Movie kaboor ayerikkum ikka alle actor
Positive , Addi poolliiii..odiyanna  kaall ushirooodukudiii  LUCIFER..MARANAA  MASSSSS
Negative , Koora padam urappa kandal aryam.. Hello
Positive , Oru rakshayum ila mass kola massss #Ettan
Positive , Trailer pollichu Last seen repeat adichukandavar like adikk
Positive , Arum angna kuttam parayatha oru trailer Nice #MAMMOOTTY !
not-malayalam , My gosh hollywood bgm and entry mammoka muwaaaa
Positive , Ikka vere level ttaaaaaa.. All the best... Ithu thakarkum
Positive , Vadakkan veeragaadhayileyum pazhassirajayileum kanakku allathe puthiya oru thalathil mammookkaye thannathinu nandhi
unknown_state , Madurajaye kandam vazhi odicha prathi Lucifer Lucifer Lucifer
Positive , Mr. Pritviraj ithaano simple cinema???? Ente romam ippozhum eneettu nilkkuva
not-malayalam , #thalapathy #vijay #tamilsong #tamilmemes #tamildubsmash #tamilnadu #tamilbgm
unknown_state , E filim ethe vare kanathavar undo
Positive , Ikka  njanngalund kude ingalu pullikku muthee
Positive , Heavy item Trailer edit chytha aaraylm sammathikanam  Veendm veendm kaanmpo thrill kooduka allaathe kurayunila  Chumma polichadukki
Negative , Voice kollillaaaa..... Charithra cinemal ingalk pattilaaaa... .....
Positive , Tovinooo tovinoo....... tovinooo tovinoooo masss..kkaa... valliyappaaa.....
not-malayalam , Lalettan fan from Hyderabad love Lal sir
unknown_state , ithenthaanu like dislike koodi 173k.. views ippolm 172k..youtube adichu poyoo
unknown_state , Like vare udayippil undaakkunna fans ayee
unknown_state , Siddique sir
unknown_state , Eee traileril main oru point und kalanghiyavar like
unknown_state , FIRST LOOK POSTER VACH NJAN OOHICHADHINEEKKAAL..... “18 PADI” MUNNIL......
not-malayalam , Unga acting super sir ..fan love from tamilnadu ..we want another film like peranbu ...mamukka
unknown_state , Ellaaa ikka fansum support cheyuthaaal trailer no:1 akkaaam
Negative , Copy full pulimurugan kanuna pole unde
Positive , Nammude swantham govt model skool...Athoru skool alla oru vigarama
unknown_state , ningal srendhicha aa mulluveliyye ...... aa mulluveli ayalude aduthek varunath......
Negative , Trailerinu munb 7k dislike adichavanmarku ulupundoda
Positive , What a Trailerori raksha illa   1;40 punch uff  mammukkaaa aaaaaaaaaa
not-malayalam , Best of luck  Laletta  From Rajuvettan fans
Negative , Aanoruthan thokkum pidich irangiya neerali alla Avante appan vare padikkum...alla pinne..ikka fans hit like
Positive , Pwlichh adukki. ...mass trailer. ....vere levell padamayirikkum. .....katta support from an ikka fan
unknown_state , Laaletan fans undenkil  like adikku.ikka fans comment cheyyu..aaarkanu kooduthal fans ennu nokkaamm
Positive , Triple pilleru dislike adichu marichittum onnum elkkanillallo
not-malayalam , Pls upload Kanupapa (mohan lal) hindi dubbed
Positive , appo E onam  apo ettanum pillerum angu edukua
not-malayalam , poster response in social media
Positive , Mammookkka ningal mwuth aaann
Positive , peter machan. onnu nokkanilla kidilen actions unadakum
Mixed_feelings , Thokk
unknown_state , Itupolulla avasarathi ee video ivde idunnate thettano ennariyilla
unknown_state , 4million 300k likumyani 10 million aakumbol kaanaam
not-malayalam , No doubt it's gonna disaster
not-malayalam , BLOOD • BROTHERHOOD • BETRAYAL
not-malayalam , Daily viewers like here
not-malayalam , From tamilnadu love u mohanlal sir
unknown_state , Abudabi delma malil vannavar like adiku
not-malayalam , Maamoookkaaa.. what a fight.. no words.....
Positive , Nthayalum ethil ninnu oru karyam manasilayi.....prithvirajinu pani ariyam.....varan ponath oru onnonnara  mothalaaaa
Negative , Video edathe dislike adikkan nanam illeaaaa ninkokkeee
Positive , LALETTAAA POLICHU  100 CR KOYYUM
unknown_state , Aa pazhaya lalettane thirichu kittiyennu thonniyavar like
unknown_state , Ithano Raju ettan paranja Oru Kochu chithram
unknown_state , Ambada kalla... Views ethra aayi ennu nokkan vannathanalle?
Positive , Powlichu. Njan ipo 25 pravisham kandu. Laletta adipoli. Katta waiting
unknown_state , Trailer 50 thavanayil kooduthal kandavar ivide like
unknown_state , Oru 500k likes um 10 m views ekke akku!!! Common everybody !!!show our power!!
unknown_state , Aju Varghese in negative role
unknown_state , Angane Malayalathinu puthiya our director koode kitti
unknown_state , Megastar fans like here  അടിച്ചു pottikkadeyy
unknown_state , Trailer view 10 M aakan wait cheyuunvr like chyu..
Mixed_feelings , Nalla subscribers ulla oru channelil ittudayirunu.... Nthayalam katta waiting  mamooka
Negative , Ini ore vijayiyum keralathil vanne negalikkan padilla
Positive , Trailer 50il kooduthal thavana kandath njan maathramaano Anna ben vineeth yettan izhtam
unknown_state , Pulimurugan fight feel cheythath enik mathram aaano
Negative , Dislike pooranmar neeti oru oombu vecho
Positive , Erian ariyunnavante kayile daivam vadi kodukku hatts of rajuvettan istam
unknown_state , Mammootty  Unni Mukundan  Prachi Tehlan  Siddique  Achuthan Anusitara Iniya Kaniha Tarun Arora Suresh krishna  Manikuttan Sudev nair Manikandan
unknown_state , യൂട്യൂബ് hang doii ettan mess ആണ് mone
unknown_state , Ee padam kanditt avante Peru enda Enn manasilayittilla
Positive , Mammooka super nalla trailer prithviraj voice
Negative , Ith dislike cheytha 12k aalkar aaranenu parayandallo
Positive , Katta waiting  for Stephen echayan 🤩🤩🤩.      Odiyan mathiri akathe erunal mathiyayirunu
not-malayalam , Wow mamagam is like Bahubali and Kayamkulam kochuni
Positive , Unda ennu peru ketapole kaliyakiyanmarodu onne parayanullu...ee padam pwolikum
not-malayalam , From Urumi  to marakar  ...i want to hit a “ parangii”  now..
not-malayalam , BIG M'S ARE SETTING FIRE ON YOUTUBE
Positive , Veendum veendum kanunna ore oru trailer Mamangam
not-malayalam , Once a king is always a king....  Mammukka
Negative , enii orikalum nii oru film um direct cheyalle poda V ASree kumari
Positive , Hatssoff Mammukka  Ee Age lum   Pride Of India
Positive , Mass +class = #lalettan Nalla katta kidu look...
unknown_state , Model schl makkal indel like adik model da
Mixed_feelings , Bro ... ithaaan mass ... Raaja 🤣🤣🤪
Positive , padam vere leval kandu  ada oru figth
Positive , Polikum Avasanathe aa varavu ho  Romancham ikka
Positive , Avasanthe Thalaivaa vili pinne aah Fight Hywaaahh Polichadukki
not-malayalam , I am a lalettan fan
Mixed_feelings , Oru variety agotu feel cheyanila full mass item avum.. onnum kanand jayettan eragila
unknown_state , LALETTAN UYIR  ALL LALETAN BHAKTHANS HIT LIKE HERE
Positive , odiyante tholvikku sesham lalettante uyarthezunelpp love you laletta
Positive , Pwolicchh.kidiln editt  kidu musc  kidu cmra  kidiln acttt   andd kiduu drctr.
Positive , Avasanam kanicha kurache seconds scenes kande FDFS urappichavar aarokkee
Negative , pls 1nu movie kanu chirikkathaver chirikkum  pattuna pani nokkuva ea70 vazhzsil pls prayathe bhamanikkunu
Positive , machaane ith polikkum......ittichante vaka oru sample vedikett maathram...ini theater pooraparambaakkkaan...ittichan oru varavukoodi varunnundenn paranjekkk......(ittimani)
Mixed_feelings , SKECH BGMNOD ENTHO SAMYAM ULLAPOLE.. ENNALUM KIDUVE...
unknown_state , sunny chechi fans undel like adi
Positive , Laaleta...manjuchechi...super hit anutto ee fillm ...I like..odiyan...
unknown_state , ithre ullo mattavanmarude power 🤣🤣🤣 dislike dislike
Positive , Ikkka   ika.....  WaitiN mamanGam
Negative , Sho.... Naatil vechu padam kaanan pattilla ennu orkumbol....
Positive , Jn ettan fan aanu parayan ullath parayanamallo ikka polichu
Positive , Ikka fans mathralla like adikkanae nammal ettan fansum like adikkum pwoli trailer
Positive , Ithihasa nadanmaril ninnu ithu polathe movies aanu pratheekshikunnathu
not-malayalam , E film chutiya kategi..faltu movie hoga pakka..
Positive , Katta waiting..... Maamokkaaaa.... Lalettan fanaanellumm..... Mammokkayeyum ishtaaaannnuuu..... Luv u mammookkaa
Positive , Last aa adi... Ammo onnim parayaanilla
Positive , King ikkak  68 nta youth laak swa swagtam
Positive , Lalettanu mass kanikkan oru chaya glass thanne dharalam
unknown_state , Coment vayichitu film kanan trill adichu nilkunnavar undel like adiku matanmare
unknown_state , Madhura raja nalla cinema ano?? Plz reply
Positive , Uff  ijaathi trailer.. adipoli #Mohanlalwood #Eeh onam nammakada makkale #ittichayan #Ettan
Positive , Padam hit laleetan fans like adi
Positive , TRAILER THEERALLE THEERALLE ENNU NOKKI KANDATH NJAN MATHRAM ANOO?????
unknown_state , Uae yil ennu varum. ? Can't wait
not-malayalam , 0:54 when you see it  Uff ikka
Negative , NALLA KIDUKACHI TRAILER  Haters dislike adikan odi vannallo
Positive , Ikka uyir Akka Athukkum mele waiting for akka with ikkasunny
unknown_state , Cinema pottiyathinnu shaesham kanunavar like adichae
Mixed_feelings , Kurachu IDI iyum.. Kurachu Kasaba iyum...ula oru Comfo feel pole indu..
Positive , Raju etta ningal pwoliya. + Lal etta ningal marana mass. Eth pwolikum. Vere level aanu
Positive , മോഹൻലാൽ ഫാനൊന്നുമല്ല. But Trailer soooper.  രാജുവേട്ടന്റെ first padam hit aavatte katta waiting
Positive , Ninglu kuttam paranjooo... But music pwoli aanuu gopi annan mass
unknown_state , Padam kandathinr shesham trailer kaanaan vannavar ethraperund
Positive , Uffffff.. mammookkkaaaa.... love youuuu...  massssss... katta waitingggg
unknown_state , Youtube stuck aayi  Views koodunnilla aarelum shraddicho
not-malayalam , UnniMukundan and Mamookka fans Like here
unknown_state , Good will uplaod aakitum. Why view koravu?
Positive , Ikkayude mamakam malayalathinte abhimanam  Ettan faninte support
unknown_state , Veendum Veendum kanunnavar Adi Like Ivide
unknown_state , mammangum trailer kandathinu shesham vannavarundel onn like adich poguu
Positive , Trailer  oru rakshem illa polich aduki
not-malayalam , KATTA WAITING  FOR  ODIYAN
unknown_state , OOO    Odiyan ????
Positive , Teaser kandappo cherthayittt sankadayi. But trailer kidu. Oru raksheeelya
not-malayalam , I love you Mammookka Happy birthday to you
unknown_state , 25il kooduthal kandavarkk like adikkaanulla comment
unknown_state , 2 Countriesinte second partinu kaathu nikkunnavarundo
unknown_state , Ippo madhuraraja teaser kanunne illalo youtubil
Positive , 10il kooduthal thavanna trailer kandavar like adi
Positive , MAMMOOKA FANSINTE ELLA VIDHA ASHAMSAKALUM NERUNNU...
Positive , Ammachee.....kidu. ( mr.sree kumar menon ithokke nokki padikk.
unknown_state , 2:09 godha film tune polle und ennu thonnunavar like
Negative , Unlike adichengilum mammookaye tholpikkumenn paranj kond pramukha  fans
Positive , kaalame ini pirakkumoo ithpoloru vismayam   Mamukka___
unknown_state , King manavalan fans like here #manavalan
Positive , Anganey avasaanam malayalathilum oru vedikkettu trailer irangi
Positive , entaponno njettichu pratheekshichathilum appuram   rajakku pattia athirali thanne. trailerinte 2nd half kodoora maaaaaaassssss.
Positive , Ithu kollaam....  expectation onnukoodi koodi...
unknown_state , Lalettan .  Lalettan fans ellarum like adikk. Enitt Pewdiepie kk subscribe cheyy
Positive , 100 crore Box office gross collection നേടിയതറിഞ്ഞു വന്നവർ ഉണ്ടോ
unknown_state , Tiyaan & Kammara Sambhavam  #Lucifer Lallettan Fance  like Here
Positive , Movie kandu super movie anu nalla oru story undu
Positive , Raja serious aane rooombaa serious  ith kidukkum🤞 Mammukka
not-malayalam , Megastar  Mammookka  Waiting 4 Mamangam  Nov 21
not-malayalam , Hit like if you are after Madhura Raja trailer??
Positive , E pasdam kanaan katta waiting cheyyunnavar
unknown_state , Ikkaa ikkaaa ..ente chomanna jatty kandaa
Positive , Rajuettan kaiadikanulla dialogues ellam swantham ettanu koduthu lle...
Positive , Mohanlalinte ee cinema pottiyaal njan ellarkkum 1crore rupees kodukkum.................. kodikkendivarilla ennnaram...... because its MOHANLAL
Positive , Marana Mass Trailer........ Katta Waiting FOr DEC 20.. Pullu Giri
not-malayalam , Any tamil mammoty fans? like here
unknown_state , Tovino Thomas katta fans  Like adiii..
Positive , veendum veendum kandu addict aayi poi
Positive , powlichu eth vere level movie ayirikum
not-malayalam , I'm Tamil... Vijay Fan... I Like Mohanlal Sir Movies...
Mixed_feelings , Padam moonjalaanelum ippp trailer kandaalum romaanjam
unknown_state , Lalettanoppam nilkkunna mattoru kadapathram athe indhrajithinteth ayirikkum.
unknown_state , Ente ponne iger pilichadukku lle
Positive , Storyum cinemayum polikkum along with mammookka
Positive , Trailer ishtapettavarkku ivide vannu like adichittu pokam
unknown_state , Dislikes illathe ituvare onnum hit aayittilla
unknown_state , Trailer polichu.... Ee trailerilum valutaanu cinema urappu.... Kaanum ennu urappullavar like cheyyu....
Negative , Pwolimpadam
Positive , Trailer kandpo thnne film poi kaanan thonnindu
unknown_state , #Stephen Nedumbally nte aalkkar ivde ndo ...  #oru like koduthe
unknown_state , 1:01 aaa shadow prithviraj alle? 🤔🤔🤔
unknown_state , lalettaa...yudham nanmayum nanmayum tammilalla... Tinmayum tinmayum tammil aanu..
Positive , Mamangam katta waiting... Trailer powlichu ikka oru rakshayum illa
Positive , Yanthiranil Rejini Annan robot aayi abhinayichu ennal robotinte koode abhinayicha asaadyapradhibha nammude swantham dhamu Aliyan
unknown_state , Muvattupuzha KL 17 machan maru Like
unknown_state , Oru 25-30 Million Views engillum ee trailerinu kittanam !
Positive , Lallettaaa polichhuu uff ejjaadi look trailer polichuu
Positive , Best wishes mammookka&team. Van vijayam aakkatte enn prathikkunnu
Positive , All the best laletta ithrem naalum kaliyiakiya naavu kondu parayuva all the BEST
Positive , D0P POLIYANE . CASTINGUM POLIYANE . LOCATIONSUM POLIYANE.
Positive , Classinu class maassinu mass ijjaathi item raaju ettan      & mammookka
Positive , Jayettanu eduthal pongayha role aan...next idi
unknown_state , Mohal lal aa filmil thovinone kaanunne polum illaa...aa filmil mohanlalinde aniyanaanh...yendh aniyan...prrrrr...kaanunne poolum illaa
Positive , Mass pakka mass lalettaaa #poli
not-malayalam , Like we get most liked Malayalam trailer Need 30k like
unknown_state , Abraham Qureshi yanno udheshichee PWOLLICHU PWOLLICHU PWOLLICHU
Positive , Lalettan polichu Pani ariyanunna Mon thanna rajuvettan
Mixed_feelings , enthokeyo evdakayo oru thakarar pole... ennalum kolaam...
unknown_state , MADHURA pazhaya kochiyallennari \r yaam..pakshe RAJA pazhaya RAJA\r tanneaa.
Positive , Njan oru katta eettan fan aayirunnu pazhassiraja kandadode oru ikkaa fan aayi Abraham polich  Ikkaaa polich Ikka bakthan
unknown_state , Pokkiri raja yil siddique inte kayi vettiyirunnu.. Ithil angane onnum thonnunilelo
Negative , Illa kaaryam mugath nokki parayum... nammakaarum bakshanam kond vannu  eetil ethikanonnula... praayamaaya veetil irikanam allathe pattatha valli thoogaruth..
Positive , Aaa urumi scene akum ettavum kooduthal kayyadi nedunnath
Positive , Malayala cinemakke oru pudiya yuva nadanekkoode kittaan pookunnu.  Waiting
Positive , trailar um padavum vere annello ethe ennaaa
Negative , Mammukka verum vishayam engneru eth enthonn chyuvanentho prayam koodum thorum glamour koodunundallo daivame
not-malayalam , 17 k views 100k like  wow..
Positive , Ithaanu njangalkk vendath...ippo oru pakka mass entertainer anivaryam... Realistic oke kandu kandu maduthu....marana waiting for kalkki
Mixed_feelings , Triler kollam... but anu sithara.... kolamakum... seriel dialogu pole parayunnund anu sithara
unknown_state , Ini yandokkee kananam sho yanikku vayyyaaa
Positive , Fight scene marana maasss repeat  adich kanuva
not-malayalam , Mudinja enga thalapathi yoda ethavathu oru trailer record muriyadinga parppom  Mersal Sarkar Bigil 🤗
Positive , Thakarthutto...  Onnalla orupaadu kaaranangalaa...  ith thakarkkum...
Negative , ikkante eazhrikath varilla ikkante varunnu kunjali marakkar  WAITING IKKA POLIKKUM
not-malayalam , Man oh man!!!!!! Goosebumps lal sir!!!!!
not-malayalam , Mammookka luv
Positive , Lalettaaa sahikkunnillaa waiting for you.... Stephen.....
Positive , Pinnne Bgm adipoli ikkayude nadatham koodi aavumbo parayandallo
not-malayalam , @FURA.  u Rockit Man.  KASARAGOD
Positive , Oru rekshayum illaa padam polichuuuu mass marana mass parayan vakkukal illaaaaaaaaa
Positive , innale 7 Mani muthal Kath Kath ninnu trailer nu vendi.....thakarppan trailer .... love you mammukkaaaaaa
not-malayalam , Trending 1 just 5 hours
Positive , Njagade lalettanum manju  chechiyum kolamass jodi annu.
Negative , enthu oola trailer aanu ithu. poor dialogue delivery
Mixed_feelings , Oru pandi comedy pandum pole unnd
Positive , Kalki Kalakki Achayane innu Mannarkadinnu kande ollu...appo ithreyum pradheeshichilla
Positive , Yessss the Lion returnzzzzz...kattaa waitingggg ikkkaaaaa
unknown_state , New gen govt piller powliennulavar like
Positive , Hollywood level mass ithanu makkale trailer
Positive , Mass entertainment... oru rekshayum illa... pwoli...
Positive , ikkaaaaa     jeevannn
unknown_state , Lucifer polichadakki kazhinchu enne thonunnavar like adikk makkale..
not-malayalam , Mohanlal sir getup Viswasam Ajith sir getup
unknown_state , 17 k views 118 k like ??
Mixed_feelings , Pazhashirajayude aduttonnum itu varilla.itu bahubalida copiyadi
Negative , Thelunku nadan ..bhaala krishnayeyum... Thal nadan vijaya kaandhineyum ..naanipichu...mammuunny...
Negative , Swondham appane kandal adikunnavanmara ithinoke dislike adikunne. Adichondu avide irikathe ullu. Ivide ettanm pillerum stronga dbl strong
unknown_state , Repeat adichu kanunnavar  ivide like അടിച്ചേ..
Positive , Njn epo 100 vattam kandu ningalo?
not-malayalam , Look like a Hollywood movie ......
Positive , Njanum oru ikka fan ann  Pashe sambavam polichu
Positive , Look kandappol surajettan serios anenna thoniyath angeru polya pand behalam vechu comedy kanikkum ippo silentay kanikkum
not-malayalam , Wow.. Trending no 1 ... Poduda visila..adra melathai
Mixed_feelings , Trail luciferinte athra illelum.... Padam heavy aaayirikum.....
not-malayalam , 1.7 M views 167k like 17 k comment ⏰ 5:5AM
Negative , E polippan trailerinokke dislike adichathu ethu keedangallannavo... kuru pottal ippazhe thundangi....
unknown_state , 50 il Kooduthal Kandavarkku Like adikkam
unknown_state , Water mark onnum ilaatha print illee???
Positive , 192K Views
Positive , Ufff  ejjathi nte ponn ikka. MAMMOOKKA UYIR
unknown_state , MEGASTAR  fans oru like adi
unknown_state , Enter perilum oru film..athum njn Canadel
Positive , Model School 🤩🤩🤩 Romanjam  Trivandrum
Positive , Raja varunnu Maniyayi.  Rajamani
Positive , Oru pucca classical ikka padam...vadakka veergatha orma vannu.  ...
Positive , Viswasichu koode nilkkunnavare jeevan koduthum samrakshikkum..  ikkayude voice & dialogue uff orujathi odukkathe feel.. romanjam at peak
Negative , Coppy ful Best actor polinhju kuthupala Edukkum
Positive , Fight scenes muzhuvan hvy  aayittind
unknown_state , Mammootty apol guest role ann alle
not-malayalam , I like both Mammuka and Lalettan evenly🤗
Positive , Ichyaaaa polich nanum indu ee moviel kalki 🤩
unknown_state , Lucifer 100 cr collection adikkumegil adi like
not-malayalam , First one minute felt like Tamil Nadu politics.
Positive , Trailer mass marana mass... Ini screen il... Padam kanan njnm undkum
unknown_state , Ikka fans like butten adich pottik
unknown_state , Poooi mekkele ayidiya kollam ketto... Thaneermethan theernu mekkele...
unknown_state , Doll inte bgm ishtappettavar like adikk
Positive , Trailer ennokke paranjal ithanu... ejjatji item
not-malayalam , Galidh rahman.  after anuraga karikkin vellam.
Mixed_feelings , 1989 il vadakkan veeragadha theateril kanda nhan veendum oru epic cinema kaanan thayyaredukkunnu.. MT yude dialogukalkk pakaram vekkan onnumilla..
Mixed_feelings , Dado Girija
unknown_state , Parayan thudangiya pande 30 varshathe karyam parayandi varum
not-malayalam , Siddiqu is imitating ummer sir in 1:11
unknown_state , IKKADE Aniyanmar pani tudangi makkale....  neerali 24 Dayz 23K like #Abtsntikl 14 Hours 43K lyk
not-malayalam , Tamil fans like here !!!!
Mixed_feelings , Itu pwolikum..laletta..iru rakshayum illa trailel..pakka professionalism..ente Oru prarthana..ippravisham manju chechide mass dialogue onnum ondkalle..kanji edukutee pole..
unknown_state , Tralier 20yil kudthall kandavarr hit like
unknown_state , Ente kuttikkalathu ente nattil undayirunnu ..odiyannnn
Positive , Appo 21 kanum   Uff poli item
Negative , Unda enna perittappo parihasicha priyadarshanu kod urundaa
Mixed_feelings , God marichu ene paranjit ole part karinje oru k.g.f feel thonni
Mixed_feelings , Thoopil Joppan poley ulla oru Item aavand irunnal mathi aarunnu🥺🥺🥺.
Negative , oru charithra cinimakku venda 3 kariyangal illa
unknown_state , Pazhassi raja poloru padam pratheekshikkunnu. From unni-ikka combo
not-malayalam , No doubt it's gonna disaster
Positive , Maoist alla Maoistnte apanae varee  nammal  putikum all the best mammoka  & unda movie team
Positive , id thakarkum  kure idavelak shesham  mammooka vs lalettan (mammoka fan)
not-malayalam , April 12 Again   L.....
unknown_state , Vishak sir 6.pm n trailer idu
Negative , Pooram kaanathe dislike adichavarkk  #naduviral pranaamam
Positive , Mammookka fight ohh romam ezhunetu nililkkum
