category,text
Positive , Enna.....or kidilan bgn aanu.. ith polikkum
Positive , vndum vndum kanan njanum und ettan
Mixed_feelings , E trailer kndapoi.... Ethra perkku kgf padam ormma vannu
Positive , Ithu oru poli polikum മാസ്സ് item
Positive , Appo engane pullaare... Pwolikuvalle
Positive , Charithra purushyan  Living legend  Mahanadanam Megastar mammootty
not-malayalam , mammootty aa name mattum pothum !
Negative , Chettatharam kanich... App upayogich dislike adichavarod
unknown_state , You tube hang ayo ??? 34K views change avunnilalo 🤔🤔🤔
Mixed_feelings , Hindi movie Newton inte vere version aano 🤔🤔.
unknown_state , Nammude kuttikale karotteku pagaram kalari padipkunnathalle nallathu.athalle nammude parambaryam..
Mixed_feelings , Kasab filmil Mammooty ye matti Tovino akiya pole ondu Telugu Padam pole
Negative , I am bangali double kundi mohannlal
unknown_state , Eee cinema kanan pokan thonnunnavar like adi.
unknown_state , Movie kanditt evide vannavar like
Positive , Oro thavana kanumbozhum romanjam ikkaaaaa
Positive , Action  scene itra manoharamai chaiyyan unniyettane kazhinje ollu bakki ellarum.......chettante carrier best aayirikkum ChandrothPanickar enna kadhapatram...waiting
not-malayalam , Inspired from Jo Jeeta Wohi Sikander?
Mixed_feelings , Lad kondupoyi  laletta onam !!sorry
Positive , Kidu item myrole...onnum parayanilllaa....adipwoli...fdfs.    Lockeddd .ikkkkkkkaaaa loveee uuu
unknown_state , Edk edk etraa likes ayi enn nokaan verunavar ivide like cheyyu
Negative , Dislike adikkan thanthaku munp undayavanmar vannallo
Positive , Adipowli trailor rajuvetta ettane powerful eyes ela seenillum
Positive , Rajayum rajede pillarum stonga tripple strong
Negative , Njan idehathinte padam kaannilla
Positive , Mammootty ..  പ്രായം 68  Mamangam Trailer..🤞  Vere.. vere..Vere level
Positive , Nalla kidilan trailer. nalla oru family entertainer aanenu thonnunu
Positive , Pazhassiraja sharathkumar polichath pole mamankam unnimukundanum polichadukkatte.... Fit body yaar
Positive , Poli ploi nte ponno romanjam
not-malayalam , samajh me nahi aya par dekh kar achha laga!
Negative , ethinu okkae dislikes adicha Prajanda kunju ghalae nighalkku uluppundo.
Positive , Athiradi mass aaan ippol thonuva chilarude realease onnum mattandayirunnu enn oru olathin
Positive , 35 minutes...watched 5 more times...Stephen nedumpalliyude kalikalkku waiting...
Positive , Poli......poli....super ikka poli super double super
Negative , Ethenna pottan kaliyo idhano big budget cenimede dialoge
unknown_state , Madhuraraja 500 cr kerumenn urappullavark like cheyyanulla comment
Positive , Padam mass verum mass alla kola mass
unknown_state , Padam kand hype adich trailer kanan vannavar like adichey nokkattey
Positive , njan oru katta ettan fan pakshe ikkayude ee unda pollikkum
Mixed_feelings , ikka fan aahn but trailer vijrcha atra vannilla . cinema endhayalum polichadukum enn viswasikunnu
Negative , Poli trailer Dislike motham mohanlal fans ayirikkum
Positive , Kuduthal thavaana kanannu thunnuna padam annu oru rakshayum illa polliwchu
Negative , Ithano trailer oru dialogue polum illa ekkaude. Ullath kurach perum oru vettum
unknown_state , November randam theeyathiyum kaanunnavar like adik
unknown_state , Which is better trailer Like__Under wold Comment__ helen
Positive , Ikkante trailerlum polichu. lalettante trailer polichu.we vacation adipoliyayirikum.
Positive , ikka mass alle.lalettan fAns kude ondu
Positive , angana pritviye kanan 5 july
not-malayalam , I'm from karnataka yash boss fan  Waiting for movie in karnataka
Negative , release polum akata 1.9k dislike adum kanata pokaruth ..  aa valya manass
unknown_state , Idhanu njanga paranja nadan ivananu NADAN  #mammootty
Positive , Lalettan Lucifer pwolich.... aduttat Mammookka de Madura Raja.... malayalatile 2 megastars
Positive , Kandu pinnum kandu veendum kandu sheham kandu ippol kandu ithu kazhinuu kandu
Positive , Oru Adaaar Item  Ikka pwolikkum Marana Maaasssssss
unknown_state , Padam. Kandu kazhinit trailer kaanan vannavar ivide like adi
Positive , Nde ponnu idivitte powlich adachu adichu powlikkeda makkale mammoooka
Positive , Oru narasimham usthad okke orumich kanda oru sughm kittyy... kuliroodu kuliru... laaleettaa... raju... no rekshaa... iniyum kaanan thonnunnavr like
not-malayalam , Mohanlal Tamilnadu fan's  like here
unknown_state , 6k likes kudi kittyal jimikki kammal song 100m aakan pattum.. Laletan fans vijaricha ethan pattana onnanu...
unknown_state , Nale keralthil box officinte maranam ayirikum....ikkanteyum pillarudayum vaka....
Positive , Eganegilum 12 aam thiyathi aaya mathiyaayirunnu katta waiting
unknown_state , 1:13  makeup illatha baby chechi...
not-malayalam , 100k like in one hour
unknown_state , Muzhuvan ipo kanikunila. Baki theatril kanaam
not-malayalam , Tovino as Rahul Gandhi Manju Warrier as Priyanka Gandhi Look like that Murali Gopi brilliance
unknown_state , Comment vaayichathu kondu video sradhikaan pattiyilla..athond Veendum kandu ..ippo VeendumIni ethra vettam kaanumenn dhaivathinu ariyaam    Edits:- ikka uyir
not-malayalam , LALETTAN IS THE KING OF MALAYALAM MOVIES......
Positive , Veendum veendum Vann kaanunnath njan maathramaano
unknown_state , 2:05 Dileep de aniyan paranjathu... chettan purathiragittu njangal pani thudangum
not-malayalam , 17k views 104k like how's it
Positive , Enthaylum... Oru adaar feel undu... Tamil look
Positive , 68 tikayunna youthanu veendum oru perunnal sammanam prisharadi vaka..
Positive , Pwoli trailer sunny chechiii istam ikka jeevanaanu
Positive , padam hit.....pani ariyavunnavar film pidichal trailer kandalum goosebumps varum
unknown_state , Mammuka polikum mammukaye ishttamullavar like adii
Positive , L.. Prithviraj  lalettanilude oru adaar item thanne kond vanno...
unknown_state , karikkele lolattenem lalettenem  eshtamullavar like adi
Positive , Adipoli trailer movie kanan wi8ing. oru psycho indannu prathishikaam
Positive , Ikka fan aanne  Ennalum parayuva kolakolli item
Negative , Puli ooodu kandam vazhi ooodan paray ipozhe
not-malayalam , Urumi   scene repeat  mode    on
Positive , Ithe kandirikkum enn ullvar like itte pokko 🤨
Positive , Njan laletten fananu ...  pakshe trailer kandu romam enittu nikkinnu
unknown_state , Innum 5 thavana kandath njan mathramano
not-malayalam , Mazz ikka  mazz bgm  Katta waiting  I am waiting.......
unknown_state , Nala fan show kk ponavar adi like
Positive , ikka and rajuettan... uff goose bumps
Positive , Sound athu screenil kanam  lalettan polikkum
Positive , Ine lucifar  loosaavum  illenkil raaja loosakkum ntammo kidu mammookka
Positive , Uff Mammookka'$ entry BGM Stunning trailer
unknown_state , Sunny chechiye kannam vanna ver like adike
not-malayalam , Adaar Love Malayalam Full Movie
Positive , Evideyo miss aaya pole pazhaya lalettane thirichu kittiya pole..thaadi vecha pinne..payyan pwoli alle....luv u. .Lalettaa...
unknown_state , Oru superhit unda manakunnavar oru like adiche
unknown_state , Ini 8 mani vare...clock nooki irikkanm
Positive , Nt ikka ingalu verm ikka allatto ponnikkaya  #romanjified
Positive , Immathiri mass  Last aa chadi idi super Ethu polikkum  Ikka um pillareum triple  Strong aaa
unknown_state , 10 M aakum ennu orappollavar adi like
Positive , Anttemoo anthayith akkee kudee oru koritharip
Mixed_feelings , Prithividae padam nalla kaaryam but manju indallo  .. pottumennu urappu!
Positive , Aa chekkan polikan ulla ella chance um kanunnund
Positive , Superb Laletta .....Love you lotsssss......Othiri ishtam Lalettane
Negative , Ithinokke dislike adichavanmare okk adichu kollanamm ettan uyirr
Positive , Ikka poliyhanu ithreyum prayathil inghanew okke nikkunillew ikka vere level annu poli ahh ikka
not-malayalam , 100K LIKES WITHIN 2 HOURS  GAME CHANGER MOVIE OF MOLLYWOOD
Positive , Ayippan poli an muthe ni an muthe hero ayappan fans like
unknown_state , Maamangam trailer kanditt vannavar like adi
Positive , Odi vidyakal kannan kathu nilkukyanu laletta
Negative , Potta padam 2million views polum illatha ee oola padam potti paaleesavum.  Antony perumbaavoor kuthuvaala Edukentiverum. {not an ikka fan}
Positive , Ente anna oru rakshaym ella.... Adipwoli
Positive , Bgm .. repeat mode .. njan maathram aano?
Positive , Ithilum mikacha trailer swapnangalil mathram
unknown_state , 17k view 100k like 10k dislike.....ithengane......🤣
Positive , Mass odiyan Mass kollamass kattaa waiting kidilam
Positive , Katta katta katta katta waiting....cant wait man
Negative , Daivam oroon kond varum... Ennit pottipoliyum... Verute collection kittan vendiii advertisement🤣🤣🤣🤣🤣🤣🤣🤣🤣🤣🤣🤣🤣🤣
not-malayalam , Mar 28  katta waiting         'L'
unknown_state , Mammookka fans like adikk pattumenkil ente channel subscribe cheyyuka
unknown_state , innale night 189k like undayirunnu. today 129k entha ithu
not-malayalam , Raja sollath polle umbum sollathu mattam umbum #ONE AND ONLY KING#L
Negative , Anthamaaya thaara aaradana aaswadana nilavara thakarchayude soochanayanu. Cinemaye swathanthravum kalaaparavumayi veekshikunna oru yuva janathayeyanu malayala cinemak aavashyam
Positive , Entho ishtam aanu ellarkum ee Ittimaniye
Positive , ikkaa polichu.. big b mood poli bgm
Positive , Machane pwolii item inka pwolikkum.   Thakarkkum
Positive , Kiduvo kidu.... .. onnum parayan illaa ...
Negative , Padma innaanu kande
Mixed_feelings , Ethippoo കൂതറയിലെ   mohanlalinte make over aayinda...
Positive , Laletta adich policho laletta Nigaloru muthaan ie padam Vijayikom nokiko apo
unknown_state , Kgf kaanada
Negative , 6.4k dislike ... Ijjathii rodhanam annaloo ....
Positive , Powlichu
Positive , LuCIfeR        polichu poli
not-malayalam , here leonardo dicarpio in thalai viduthalai song
not-malayalam , Hoping for a good movie after anuragakarikin vellam
Positive , Soubinum Suraj ettanum polichuuuu padam poliiiii  oru family ayittum kannan pattiya nalla padaaammm
Positive , E... Nanjankottayil aarudeyumkanneroppan vannavanalla njan... Ennal karayikunnavanteyokkry Tala njan adichupolikum...   Kidu kidu kidu mass punch dialouge....
unknown_state , Viewers 16k like 85k ithengane 🤔
unknown_state , Raja 100 cr urappullavar adi like
Positive , Mammokka Ennum oru lahariyaanu.Annum Ennum athbudappeduttiyittey ullu. Padam oru vambhan hittakum..minimum 250cr  kadakkum..lookam vaaythum mammotty enna
Positive , Acting ഒരു രക്ഷയും illa.... baki illathoke pinne
Positive , Ivide Palakkad Jayettan Fans club nnu ashamsakal!!! Adichal romam ennikum athaanu Thrissur pooram
Positive , പടം പൊളിക്കും HBD mammokka       By Die hard ettan fan
unknown_state , Releaseinu 1 week munne ithu onnum koodi kanan vannavar undo?
unknown_state , Usha udup paadiya lucifer anthem ethanu? Padathil kandilallo.. Arkenkilum ariyo..?
Mixed_feelings , Mobile phonil kadapoolee ekkane ??appole theateril anakilo
unknown_state , Edayk edayk views nokan varunath njan mathram aano🤔
Positive , Onnum parayan illa laletta u trigger again ...
Negative , Dae Ajithaaa copy adikathada Mohan Lal
unknown_state , Kfc chicken vekkaan kayariyappol
unknown_state , oru moideenum  katinintavila odiyan vendi
Negative , Gilla plus loham plus ramaleelaa...naariya kopi adiii
Positive , Dear Mammookka
Positive , Onnil kuduthal kanda trailer ambooo powli....
not-malayalam , HAPPY BIRTHDAY MAMMOOKA BY ETAN FAN
Mixed_feelings , Ramesh pisharadi aanu director ennu kettapo valippu padam aakumennu karuthi..trailer kandapo mosamakilla ennoru prithisha vannu..
Negative , Official trailer release aakunnathinu mumbe dislike adikkan kure mammunni fans oolakal..
not-malayalam , Watching again and again and again and again  for mammookkaa
not-malayalam , By the by  Prithviraj &suraj ??
Positive , As a mammokka fan trailer kidukki padam nalla oru vijayamayi theeratte
Positive , Youtube hang avan ready ayiko L
Negative , ippo mansilai e padam 8 nilayil pottum
unknown_state , FDFS book cheyyum ennu urappullavar ivde likikkoo
not-malayalam , Oohh my Godddd
Positive , Onnu urappa full entertainment movie yaa.. Yente ponnu ikka fans onnu kaddak pidichaal oru blockbuster engu poorum ....
Positive , Lalettan - Prithivi combo vera level...  Pwolichu Lalettan & Prithivi fans like adiku makkale
unknown_state , Like kuddunnu onnd pakshe views kuddethe enthaa
Positive , Mammooka die Hard fans LIKE adichu polikk ith logam kaathu ninna RAJA yude varav ith polikkum
Negative , 29K Dislike adichavar Padam kandu kaanum lo... Oro Dhurendhangal...
Negative , Alinje polinja trailer.. odiyan aakumo ?? 🤓🤓
unknown_state , Padam kandit trailer kanan vannavarundooo
unknown_state , Mmk ikkem ettananum ore level aannnu ath vere level
Negative , Dialogue pora msmmookka paranjaal onnoode ushaaraayene
Positive , trailer kidukki look at the likes
Positive , 38k views 20k like polichu
Positive , Tovino.Namak uruttane... Ayyyo adipoki mass muvi ayrkum katta waiting
Positive , Direction maarakam prituiraaj nee tanne cheytathaano atho ariyunnavare kondu cheyyichathaano aaraayaalum massayittundu Well job man
unknown_state , Nammda akshay daavin oru like adi
unknown_state , Mammookka  Haneef Adeni shaji padoor  Gopi sunder  Mahesh narayanan
not-malayalam , SECOND BOX OFFICE GROSSER IN MALAYALAM   MEGASTAR MAMMOOKA
unknown_state , Athoru valya kathaya Mone paranju thudangiyaal oru 10-30kollathe charithram parayendivarum
Positive , Ichayan kasari. Kiduki. Porich. Njgal tcr karude swagraya ahagaram
unknown_state , 9.6k dislikes from Antony perumbavor ( undaya.......)
unknown_state , Traileril Oru kidilan surprise undakum ennu visvasikkunnavar like adii..
unknown_state , Like nokaan varunnadh njan mathramaano..
Positive , King is oll ways king 🤙  ഏട്ടൻ ഇഷ്ട്ടം
Mixed_feelings , Amitha pratheesha vekunila anyway katta waiting #L
not-malayalam , full bgm ...  #jjstudioz #kalki
not-malayalam , O M G heavy mamookkaa
Positive , Nenjinakath Lalettan Nenjuvirich kond parayum numma oru lalettan fan anenn _______________katta waiting
Mixed_feelings , sathyam paranjaal trailer oru maja illaa
Mixed_feelings , Padam average filim mathrameyullu fansukar pokkiparayunna rasamonnum padathinnillaa
Positive , Vannu vannu avan vannuIkka love yuu
Mixed_feelings , Evdeyokkeyooo Oru pulimurugan...dadi Girija.. Fight.. Music...... Evdeyokkeyooo 🤔🤔🤔
Positive , Happy birthday mammukka  gana gandharvan polichadukkum next block bluster
Positive , Nte ponnnoooo enthaaa makkkale immmale ikkkkade aaa oru idh🥰🥰🥰
not-malayalam , Lalettan fans and prithviraj fans hit like
Positive , entry istam like for lusifer lalettan
unknown_state , Katta ikka fans indangi like adichu pottiku
Positive , Oru rakshayumilla.repeated mode on... Njan kandathil vech ettavum best trailer
unknown_state , 68 vayassunden oke paranj ingane pattikkale en parayanam sire....
unknown_state , Bilal john kurishingalinte aniyan aano ini
unknown_state , arokee ningaldee comentsnu etraa like kittenu nokkan vannu
not-malayalam , Nov 21 pakkalaam intha kaaliyude aattathe
Positive , Katta pretheekshaaa....... Luv u alla ...
unknown_state , Poram lokham ariyatte HBO Channelil parashiraja kanaichath pole .peranpu pole ikkayilude malayala cinimaye ariyatte .
Positive , Eeee cinema thanna venuchettan muthaaan muthumaniyaanu
Positive , Ente ponno......maranamass item. Kidilan making. Fight apaaram. Sound modulation oru rakshayumilla. Oru adaru item thanne
not-malayalam , Hindi movie (old  Darmki dese remek
Positive , Ini vendathu oru 100kodiyanu... athu ithiloode kittatte
unknown_state , 0.50 athu nammude Marimayam Unni alle?
Positive , Padam vere level aaavum.... Mammulaaaal fanz
Mixed_feelings , Teaser pole oombiyilla.... Trailer kidukki....   Lalettan Fan
Mixed_feelings , Kozhopolla
Negative , 6.3 dislike veru verupp athanne karanam
unknown_state , Ndaapooo ndayee.....inendaa vishuaa....ara ewde padakam pottichee....  uff romanjam_ahangaaram#ikka
Positive , Mamangathine  Ajaygopal  fansinde vijayasamsakal.
Positive , Ende ponnoe ejathy trailer kandall ariyam ikka ethu rengill ulla allannennu
unknown_state , Njan mathramanoo. Ith veedum veedum kanunnath
Positive , Orroo...framintayum quality     Rajuattan magic
Positive , Mammootty pwolikkum
Positive , Mammookka..... Uff ijjathi .. Ente ponnikkkaa polichuuu.... Katta waiting
unknown_state , Lalettante Adutha  100 Kodi ithayirikkumodiyan  enthaaa sheriyalle
unknown_state , Malayalam padam odikkenda takkesil achayn keri telugu padam odichuuuu
Negative , Haters pani thodangind makkale.....sahikunnilla avrkithe kanditte..
unknown_state , Ee pani thannaya kure kalamayii cheyunne.pani ariyavunthathu kondaa pidichu nilkunnaaa...mass and class dialogue..luv u ekkaaa
not-malayalam , 100k likes in 1 hr.
unknown_state , madhura raja trailer kandu.athinte hangover maran lucifer trailer repeat adichu kandu.ippozha samadhanamaye!
not-malayalam , 105 k likes.. 17 k views 🤔🤔
unknown_state , Raja raja raja...madhura veera raja
Positive , Aettanta padathin ikka fansnte ashamsakal 🤗🤗🤗
Negative , Yedaa Mamooty poora
not-malayalam , I'm from Telangana.  Love you Mohanlal sir .
Positive , avasanethe chadiyulla adi adh polich ikkaaaaaa
unknown_state , RAJA RAJA RAJA MADHURA Veera RAJA
Negative , Madhuraraja teasor kandu nalla katta bore ayittu undu. Mammukka ethavana yum Vishnu Unnikrishnan tae boxoffice records vettikkum ennu thonunilla.
Positive , Ente Ponno Goosebumps  ... kidu bgm
unknown_state , fans ticket kittiyavar ivide like adii
Positive , Trending No . 1. Varanam jayettan daaaaaaaaaaa
Mixed_feelings , Pratheeksha nallonam und
Negative , Unlike adicha mammunni fansinu irikkatte oru kuthirapavan
Positive , Jeyetta padam full undo trailer il?? Sambavam colour aayittundalloo...
not-malayalam , Thriller movie
unknown_state , Mamakam Hit Aavum ennulever adi makkale like
Negative , Family entertainer? Family kk kanan pattatha movie full inner meaning
unknown_state , Sambavam deep freezeril pettu poyi athann
Positive , Vere Level One  Ikka - Rajuvettan
Positive , Entae jeevathil ithrayum pravishyam trailer kanda verae oru cinemayum illa
Positive , Kidu frames kidu bgm ellarum kidu look kidu making pinne kidilolkidilan Lalettanum verentha vende heavy
unknown_state , Ethra viewers ayi ennu nokkan varunar arokeya..
unknown_state , ith rajuvattante sambil lusipur adaar aitam varunnu MEAGA STAR MAMMUKKAYAN MAKKALE
Mixed_feelings , Njaanum our Tovino enna actora ishtapedunna alu thannaya trailer mass ayitundu but achaayanta soundinu mass effect kurachu kuravaanu
not-malayalam , Thalaivaaa 🤩 🤩🤩 🤩🤩 🤩🤩 🤩🤩 🤩🤩 🤩
Negative , Madhurarajakku madhuram theereyundakilla bhayankara kaypayirikkum njan panthayam vekkam
Positive , Ikkaaaaa. Ingale ennaa level aah. Ee prayathilum body... Muthane
Positive , Raju ettan powli
not-malayalam , New benchmark in malayalam cinema. ..
Positive , Trailer cut ഒറ്റപേര് editor Donmax വേറെ ലെവൽ
Negative , Oh iyalude Ela padavum iyalu jailil kidana anubavavumayi copy Anu Nala pila anu enu kqnikan akum.
Positive , innanu movie kandathu.....kidu nnu paranjal pora......kidilokkidilam
Negative , Trailer ethanennu mumbu thanne kore peru dislike adichatind Ivanmaaroke aanu e naadinu shapam champu naarikalu
Positive , Idvere vere chilar parannadaaannn muruga nee theernnada ennn ..ini nangal mammookka fans sherikkum parayunnnu .....MURUGAAA ....NEE THEERNNADA .IKKA LOVE
unknown_state , Ith surajinte padamaane enne thoniyarvar like adikku
Positive , sathyam parayalow kaNubol ente police traing kalam ormavarunu
Positive , Dislike adichavarod nammal lalettan fans n verum  pucham matrame ullu  Lalettan ishtam Lalettan uyir
Positive , 50.dhe pravshyem  kandu kolakkolli trailer
unknown_state , Katta ikka fans unddegil like adi..
unknown_state , Haha..1.35 il raajuvettane kandavar ivide like adichee
Negative , Iyaalkkokke cinema nirthi DQ nte makkale nokki veettil irunnoode..?
Positive , Enta ponna oru rashayum ila kidu padam
Positive , Suraj ettan powli..koode soubin ekka...pine paryano ....katta Waiting anee
not-malayalam , Intha trailer ah pathutu nama  thala ajith yabagam vanthavangala like podunga..
Positive , Trailer kandappazhe urappichu padam mass vijayichu
Positive , im from mars but i love laletan
Positive , Ikkayude johny walker ormma varunnuu vere level
Positive , Ithupole oru trailer iniyundakumennu thonunnilla. Superb
Positive , IKKA PWOLI BGM oru rakshayum illa
Positive , Jayasurya chettan mass lookaaa pakka mass don
Positive , Mammookka de adutha 100 kodi padam aayirikkum #UNDA ennu urapp ullavar like adikkada pillere...
Negative , 6.1k mamunni fans ithe kandu ennu aa dislike button kandapol manasilayi
not-malayalam , I'm from Tamilnadu...i like mamooty sir.. trailer
Negative , dayav cheyth pretham 3 irakkaruth plzzz athrank unda padamaayirnn pretham 2
unknown_state , Su sugunan su gu sugu su gu suu bug una
unknown_state , Avasanam sathya moorthy ips avathorunna mati🤣🤣
not-malayalam , Very good movie-making skills in your language.. keep up the good work
unknown_state , Villain Tovino & vivek oberoi ...( just a guess )
Positive , Ikka fan aaya Nikku nalla urappundu
Positive , Ikka powlichu onnum parayanilla trailer ethanel padam enthakum
Negative , To be very frank
Positive , Tovino look. & BGM vere level
Mixed_feelings , bgm korachoode nannaakkayirunnu..fan made bgm poley.....
unknown_state , Pinneum pinneum ithu kaanuna ethra peer und
unknown_state , Laletttaaan fans adichu potikda like button
Positive , Mass mass pakka masss
unknown_state , Njaan aadym vichaariche punyalan 3 aanenaa
Positive , Mamangam...nte ammooo marana massss...trailer....   verum item allaaa.... ith oru onnonnara item anuu....ikkaaaaaaa
unknown_state , 16k views.. But 56k like.... എപ്പിടി 🤔
unknown_state , Ikka bakthanmaar like adi   Ikka istham
Mixed_feelings , Teaser ille kittiya mass triller ille kittilla
unknown_state , Madhurarajaykku LUCIFER inte half like polum kittillannu urappullavarkku like adikkan after # madhuraraja trailer
not-malayalam , Happy birthday mammookkaaaaaaaaa Ilove you   Ganagandharvan waiting
Negative , Dislike adikan mtram Kure per nokiyiriunna polund
unknown_state , 1 1/2kaalan police randu kaalukalumayyi veedum
Negative , Oru pandi padathinte trailer innu irangiyitundu...kandavar onnu parayane..avide ellaam thribilaa🤣🤣🤣
Positive , Njan oru ikka fan alla paksha as a malayali i am katta weiting for raja 2
Negative , Dislike adichavar ettavum valiya oolakal...... bldy idiots...
Positive , Karayippikuvo muthe... Happy bday ikka.... Waitg
Negative , Eth vetavalliyanmara dislike adiche..
not-malayalam , Evan evan lam #maduraya sontham kondaduvathunu vevastha ilama pochuda...
not-malayalam , superb trailer  dileepettan & sidhique ikka best of luck
Negative , Kanunnathinu munpe dislukke like adichaa ellaa malavangalkkum ente naduviral namaskaram
Negative , Ithu enthanu kilichundan mambazhamb 2 parto..hihi comedy padamanennu thonunnu
unknown_state , Ravile eneet trailer kanan vannavar ndo....
Positive , Lalletan fansinte ella supportum und ikka.....  Ethu porikum.... Oru samsayavum venda...
Negative , ith oru oola padam aayirikum enn manass parayunu
unknown_state , Kalkikku malayalathinte dhathuputhran alluarjun fansite vijayaashamsakal
Positive , Ravanan aya avane nerkuner illaathakkan oru maha avatharam thanne vendi varum....poli
unknown_state , Fans kaar.... Pls padathinu hype koottaruthu... Ithu oru sadharana cinema yanu... Dayavu cheythu nashippikkaruthu....
unknown_state , Trailer kidu aie annulavarkke Likam (onnu likada)
not-malayalam , If you are bad im your dad
Positive , Happy birthday Ikka love u  Pratheeshkal athiru kadanu Ganagandarvan keralakara keezhadakum
Positive , Oru pooram Trilar Vijariichu Vannappooo oRu Mass Trilar aayiii thoonniyavarr Like Aahdii.....
not-malayalam , maarana mass  Raja is back
not-malayalam , Big waiting for Mamangam
Positive , Trailer kollarkium nu oru pratheeksha ondarinnu...pakshe ithu athukkum mele
unknown_state , Prithviraj Undennu Arinju Trailer Kandavar Like Adiku  1:01 Zayed Masood
Negative , Eathu nayinte makkal avao dislike adiche
Positive , Polichu ikka suppar u r great
Positive , Ith ini indian cinema yude mamangam
unknown_state , Madhura Raajaye pottikkum ennavar like adi
Negative , Dislike um kurayunnu..23k ninnu 13k aayi...appo ee chettatharam kanichathu aaru ennu parayendelloo
unknown_state , Mammookka  unni mukundan  achuthan
Positive , Ipo tanne 5 vattam kandu vallatoru trailer
Positive , Super  bb.  Lalettaaaa
unknown_state , Lucifer lucifer lucifer a10 a10 a10
not-malayalam , First l00crore Malayalam film pulimurrukan First 200crore odiyan is loading
unknown_state , Padam kandu.. ennittum veendum tralier kaanan thonunnu.....
not-malayalam , @ 1:03
Positive , Njanetha parayendath......... Onnum parayaanilaaaaaaa..... Laaaaalettttttttttaaaaaaaaaa.......ummmmmm aaaaaa
Positive , Pworich kurach kalangalaayi ijjathi padem Tamil mathram aannu kandirunnath .eni malayalathilum kannaan ulla bhagyem Ind .Poli Poli poli
Mixed_feelings , Next pullikaran stara or uncle loading 🤭
Positive , Trailer  kalaki Pwolichu  madhura raja cenimakku vendi katta waiting
Positive , Super trailer cinema kandale  bakkie parayan kaziykka llu
unknown_state , 100 k avunnath mumbe kandavar like
Positive , Ithu pole bgm ulla mass trailer ithu vare iragiyittila .
Negative , Music chila sthalangalil alambayi ....dialogue perfection kittunnilla
unknown_state , Ekka @ Madhura Raja
Negative , Dislike full odiyan kanji fans
Positive , Odiyante sheenam njnga lalettante piller ee luciferil ang theerkum....
Negative , Class trailer
Positive , Lalettan illatha eanth sinima le makkale kodk like
Positive , Rajuvetta ningal maranmass love you oru great success avate....
Positive , Lucifer movie kanditt  ethil comment edaan vannavar like adi.....  Mass lucifer lalettan mass
